{
  "version": 1,
  "id": "tl-20260621-tokyo-daylight",
  "source": {
    "place": "Tokyo",
    "lat": 35.6812,
    "lon": 139.7671,
    "tz": "Asia/Tokyo",
    "start": "2026-06-21T04:25:00+09:00",
    "end": "2026-06-21T19:00:00+09:00"
  },
  "speed": 480,
  "loop": false,
  "frames": [
    { "t": 0, "event": "sunrise", "sky": [255, 120, 60], "bri": 10, "sun": 5, "mist": 30, "rain": 0 },
    { "t": 1800, "sky": [255, 170, 110], "bri": 30, "sun": 25, "mist": 10 },
    { "t": 5400, "sky": [150, 200, 255], "bri": 60, "sun": 60, "mist": 0 },
    { "t": 26100, "sky": [120, 180, 255], "bri": 100, "sun": 100 },
    { "t": 45000, "sky": [170, 200, 255], "bri": 70, "sun": 70 },
    { "t": 50700, "sky": [255, 150, 80], "bri": 35, "sun": 30 },
    { "t": 52500, "event": "sunset", "sky": [200, 80, 50], "bri": 10, "sun": 0 }
  ]
}
