{
  "version": 1,
  "id": "tl-20260930-tokyo-now",
  "source": {
    "place": "Tokyo",
    "lat": 35.6812,
    "lon": 139.7671,
    "tz": "Asia/Tokyo",
    "start": "2026-09-30T14:00:00+09:00",
    "end": "2026-09-30T15:00:00+09:00"
  },
  "speed": 1,
  "loop": true,
  "frames": [
    { "t": 0, "sky": [180, 190, 200], "bri": 60, "sun": 40, "mist": 0, "rain": 0 },
    { "t": 1200, "sky": [160, 170, 185], "bri": 50, "sun": 20 },
    { "t": 2400, "sky": [180, 190, 200], "bri": 60, "sun": 40 },
    { "t": 3600, "sky": [180, 190, 200], "bri": 60, "sun": 40 }
  ]
}
